{
  "meta": {
    "project_name": "Flower Room 5",
    "client": "Producer B",
    "prepared_for": "Producer B",
    "site_address": "Quebec, Canada",
    "company": "Example Hort Lighting",
    "designer": "J. Designer",
    "units": "imperial",
    "design_hours": 43.4,
    "information_provided": [
      "Salle de floraison 50 x 36.75 pi, plafond 14 pi",
      "Cible 1200-1300 µmol/m²/s à 6 pi des luminaires"
    ],
    "date": "2026-05-20"
  },
  "site": {
    "type": "indoor_room",
    "width": 36.75,
    "length": 50,
    "height": 14,
    "wall_reflectance": 0.8,
    "ceiling_reflectance": 0.8,
    "floor_reflectance": 0.2
  },
  "fixtures": [
    {
      "id": "z900",
      "name": "900 watts LED",
      "family": "Generic 900 W top light",
      "manufacturer": "Generic",
      "watts": 900,
      "ppf": 2400,
      "warranty": "5 year limited warranty",
      "length": 3.6,
      "width": 3.6,
      "distribution": "batwing",
      "beam_angle": 120
    }
  ],
  "canopies": [
    {
      "label": "PPFD GRID",
      "x": 2.375,
      "y": 3,
      "width": 32,
      "length": 44,
      "height": 3
    }
  ],
  "layout": [
    {
      "fixture": "z900",
      "mode": "explicit",
      "positions": [
        [
          4.375,
          4.6923076923076925
        ],
        [
          8.375,
          4.6923076923076925
        ],
        [
          12.375,
          4.6923076923076925
        ],
        [
          16.375,
          4.6923076923076925
        ],
        [
          20.375,
          4.6923076923076925
        ],
        [
          24.375,
          4.6923076923076925
        ],
        [
          28.375,
          4.6923076923076925
        ],
        [
          32.375,
          4.6923076923076925
        ],
        [
          4.375,
          8.076923076923077
        ],
        [
          32.375,
          8.076923076923077
        ],
        [
          4.375,
          11.461538461538462
        ],
        [
          32.375,
          11.461538461538462
        ],
        [
          4.375,
          14.846153846153847
        ],
        [
          32.375,
          14.846153846153847
        ],
        [
          4.375,
          18.23076923076923
        ],
        [
          32.375,
          18.23076923076923
        ],
        [
          4.375,
          21.615384615384617
        ],
        [
          32.375,
          21.615384615384617
        ],
        [
          4.375,
          25.0
        ],
        [
          32.375,
          25.0
        ],
        [
          4.375,
          28.384615384615383
        ],
        [
          32.375,
          28.384615384615383
        ],
        [
          4.375,
          31.76923076923077
        ],
        [
          32.375,
          31.76923076923077
        ],
        [
          4.375,
          35.15384615384615
        ],
        [
          32.375,
          35.15384615384615
        ],
        [
          4.375,
          38.53846153846154
        ],
        [
          32.375,
          38.53846153846154
        ],
        [
          4.375,
          41.92307692307692
        ],
        [
          32.375,
          41.92307692307692
        ],
        [
          4.375,
          45.30769230769231
        ],
        [
          8.375,
          45.30769230769231
        ],
        [
          12.375,
          45.30769230769231
        ],
        [
          16.375,
          45.30769230769231
        ],
        [
          20.375,
          45.30769230769231
        ],
        [
          24.375,
          45.30769230769231
        ],
        [
          28.375,
          45.30769230769231
        ],
        [
          32.375,
          45.30769230769231
        ]
      ],
      "mounting_height": 9
    },
    {
      "fixture": "z900",
      "mode": "explicit",
      "positions": [
        [
          8.375,
          8.076923076923077
        ],
        [
          12.375,
          8.076923076923077
        ],
        [
          16.375,
          8.076923076923077
        ],
        [
          20.375,
          8.076923076923077
        ],
        [
          24.375,
          8.076923076923077
        ],
        [
          28.375,
          8.076923076923077
        ],
        [
          8.375,
          11.461538461538462
        ],
        [
          12.375,
          11.461538461538462
        ],
        [
          16.375,
          11.461538461538462
        ],
        [
          20.375,
          11.461538461538462
        ],
        [
          24.375,
          11.461538461538462
        ],
        [
          28.375,
          11.461538461538462
        ],
        [
          8.375,
          14.846153846153847
        ],
        [
          12.375,
          14.846153846153847
        ],
        [
          16.375,
          14.846153846153847
        ],
        [
          20.375,
          14.846153846153847
        ],
        [
          24.375,
          14.846153846153847
        ],
        [
          28.375,
          14.846153846153847
        ],
        [
          8.375,
          18.23076923076923
        ],
        [
          12.375,
          18.23076923076923
        ],
        [
          16.375,
          18.23076923076923
        ],
        [
          20.375,
          18.23076923076923
        ],
        [
          24.375,
          18.23076923076923
        ],
        [
          28.375,
          18.23076923076923
        ],
        [
          8.375,
          21.615384615384617
        ],
        [
          12.375,
          21.615384615384617
        ],
        [
          16.375,
          21.615384615384617
        ],
        [
          20.375,
          21.615384615384617
        ],
        [
          24.375,
          21.615384615384617
        ],
        [
          28.375,
          21.615384615384617
        ],
        [
          8.375,
          25.0
        ],
        [
          12.375,
          25.0
        ],
        [
          16.375,
          25.0
        ],
        [
          20.375,
          25.0
        ],
        [
          24.375,
          25.0
        ],
        [
          28.375,
          25.0
        ],
        [
          8.375,
          28.384615384615383
        ],
        [
          12.375,
          28.384615384615383
        ],
        [
          16.375,
          28.384615384615383
        ],
        [
          20.375,
          28.384615384615383
        ],
        [
          24.375,
          28.384615384615383
        ],
        [
          28.375,
          28.384615384615383
        ],
        [
          8.375,
          31.76923076923077
        ],
        [
          12.375,
          31.76923076923077
        ],
        [
          16.375,
          31.76923076923077
        ],
        [
          20.375,
          31.76923076923077
        ],
        [
          24.375,
          31.76923076923077
        ],
        [
          28.375,
          31.76923076923077
        ],
        [
          8.375,
          35.15384615384615
        ],
        [
          12.375,
          35.15384615384615
        ],
        [
          16.375,
          35.15384615384615
        ],
        [
          20.375,
          35.15384615384615
        ],
        [
          24.375,
          35.15384615384615
        ],
        [
          28.375,
          35.15384615384615
        ],
        [
          8.375,
          38.53846153846154
        ],
        [
          12.375,
          38.53846153846154
        ],
        [
          16.375,
          38.53846153846154
        ],
        [
          20.375,
          38.53846153846154
        ],
        [
          24.375,
          38.53846153846154
        ],
        [
          28.375,
          38.53846153846154
        ],
        [
          8.375,
          41.92307692307692
        ],
        [
          12.375,
          41.92307692307692
        ],
        [
          16.375,
          41.92307692307692
        ],
        [
          20.375,
          41.92307692307692
        ],
        [
          24.375,
          41.92307692307692
        ],
        [
          28.375,
          41.92307692307692
        ]
      ],
      "mounting_height": 9,
      "dimming": 0.75
    }
  ],
  "target": {
    "ppfd_min": 1200,
    "ppfd_max": 1300
  },
  "calc": {
    "grid_spacing": 2
  }
}